{
  "schemaVersion": 1,
  "defaultProfile": "daily",
  "discovery": {
    "adapters": [
      "dotnet"
    ]
  },
  "projects": [
    {
      "id": "project-01",
      "path": "src/project-01"
    },
    {
      "id": "project-02",
      "path": "src/project-02"
    },
    {
      "id": "project-03",
      "path": "src/project-03"
    },
    {
      "id": "project-04",
      "path": "src/project-04"
    },
    {
      "id": "project-05",
      "path": "src/project-05"
    },
    {
      "id": "project-06",
      "path": "src/project-06"
    },
    {
      "id": "project-07",
      "path": "src/project-07"
    },
    {
      "id": "project-08",
      "path": "src/project-08"
    },
    {
      "id": "project-09",
      "path": "src/project-09"
    },
    {
      "id": "project-10",
      "path": "src/project-10"
    },
    {
      "id": "project-11",
      "path": "src/project-11"
    },
    {
      "id": "project-12",
      "path": "src/project-12"
    },
    {
      "id": "project-13",
      "path": "src/project-13"
    },
    {
      "id": "project-14",
      "path": "src/project-14"
    },
    {
      "id": "project-15",
      "path": "src/project-15"
    },
    {
      "id": "project-16",
      "path": "src/project-16"
    },
    {
      "id": "project-17",
      "path": "src/project-17"
    },
    {
      "id": "project-18",
      "path": "src/project-18"
    },
    {
      "id": "project-19",
      "path": "src/project-19"
    },
    {
      "id": "project-20",
      "path": "src/project-20"
    },
    {
      "id": "project-21",
      "path": "src/project-21"
    },
    {
      "id": "project-22",
      "path": "src/project-22"
    },
    {
      "id": "project-23",
      "path": "src/project-23"
    },
    {
      "id": "project-24",
      "path": "src/project-24"
    },
    {
      "id": "project-25",
      "path": "src/project-25"
    }
  ],
  "profiles": {
    "daily": {
      "include": [
        "README.md",
        "*.sln",
        "Directory.*.props"
      ],
      "projects": [
        "project-01",
        "project-02",
        "project-03",
        "project-04",
        "project-05",
        "project-06",
        "project-07",
        "project-08",
        "project-09",
        "project-10"
      ],
      "dependencyClosure": "strict"
    }
  }
}
